BibtexKey,Title,Abstract,Author,Journal,BookTitle,Year,Doi,Url,Source,CreatedAt,Status
Srivastava201912,Hospitality of chatbot building platforms,"The temptation to be able to talk to a machine is not new. Recent advancements in the field of Natural Language Understanding has made it possible to build conversational components that can be plugged inside an application, similar to other components. These components, called chatbots, can be created from scratch or with the help of commercially available platforms. These platforms make it easier to build and deploy chatbots, often without writing a single line of code. However, similar to any other software component, chatbots also have quality concerns. Despite significant contributions in the field, an architectural perspective of building chatbots with desired quality requirements is missing in the literature. In the current work, we highlight the impact of features provided by these platforms (along with their quality) on the application design process and overall quality attributes. We propose a methodological framework to evaluate support provided by a chatbot platform towards achieving quality in the application. The framework, called Hospitality Framework, is based on software architectural body of knowledge, especially architectural tactics. The framework produces a metric, called Hospitality Index, which has utilities for making various design decisions for the overall application. We present the use of our framework on a simple use case to highlight the phases of evaluation.We showcase the process by picking three popular chatbot platforms - Watson Assistant, DialogFlow and Lex, over four quality attributes - Modifiability, Security & Privacy, Interoperability and Reliability. Our results show that different platforms provide different support for these four quality attributes. Copyright © SQUADE 2019 ACM SIGSOFT International Workshop on Software Qualities and Their Dependencies, co-located with ESEC/FSE 2019.All right reserved.","Srivastava, Saurabh and Prabhakar, T.V.","SQUADE 2019 - Proceedings of the 2nd ACM SIGSOFT International Workshop on Software Qualities and Their Dependencies, co-located with ESEC/FSE 2019",,2019,10.1145/3340495.3342751,https://www.scopus.com/inward/record.uri?eid=2-s2.0-85076478035&doi=10.1145%2f3340495.3342751&partnerID=40&md5=e843563d3049e4d2b9860b299c0c9798,scopus.bib,2023-09-02 14:05:29,Unclassified
Arora201815,Exploring Siamese neural network architectures for preserving speaker identity in speech emotion classification,"Voice-enabled communication is increasingly being used in real-world applications, such as the ones involving conversational bots or “chatbots”. Chatbots can spark and sustain user engagement by effectively recognizing their emotions and acting upon them. However, the majority of emotion recognition systems rely on rich spectrotemporal acoustic features. Beyond the emotion-related information, such systems tend to preserve information relevant to the identity of the speaker, therefore raising major privacy concerns from the users. This paper introduces two hybrid architectures for privacy-preserving emotion recognition from speech. These architectures rely on a Siamese neural network, whose input and intermediate layers are transformed using various privacy-performing operations in order to retain emotion-dependent content and suppress information related to the identity of a speaker. The proposed approach is evaluated through emotion classification and speaker identification performance metrics. Results indicate that the proposed framework can achieve up to 67.4% for classifying between happy, sad, frustrated, anger, neutral and other emotions, obtained from the publicly available Interactive Emotional Dyadic Motion Capture (IEMOCAP) dataset. At the same time, the proposed approach reduces speaker identification accuracy to 50%, compared to 81%, the latter being achieved through a feedforward neural network solely trained on the speaker identification task using the same input features. © 2018 Association for Computing Machinery.","Arora, Priya and Chaspari, Theodora","Proceedings of the 4th Workshop on Multimodal Analyses Enabling Artificial Agents in Human-Machine Interaction, MA3HMI 2018 - In conjunction with ICMI 2018",,2018,10.1145/3279972.3279980,https://www.scopus.com/inward/record.uri?eid=2-s2.0-85058175685&doi=10.1145%2f3279972.3279980&partnerID=40&md5=df3053ad6f6699356bcab7aa1cea1c5a,scopus.bib,2023-09-02 14:05:29,Unclassified
WOS:000882790100004,"Designing, Developing, Evaluating, and Implementing a
Smartphone-Delivered, Rule-Based Conversational Agent (DISCOVER):
Development of a Conceptual Framework","Background: Conversational agents (CAs), also known as chatbots, are
computer programs that simulate human conversations by using
predetermined rule-based responses or artificial intelligence
algorithms. They are increasingly used in health care, particularly via
smartphones. There is, at present, no conceptual framework guiding the
development of smartphone-based, rule-based CAs in health care. To fill
this gap, we propose structured and tailored guidance for their design,
development, evaluation, and implementation. Objective: The aim of this
study was to develop a conceptual framework for the design, evaluation,
and implementation of smartphone-delivered, rule-based, goal-oriented,
and text-based CAs for health care. Methods: We followed the approach by
Jabareen, which was based on the grounded theory method, to develop this
conceptual framework. We performed 2 literature reviews focusing on
health care CAs and conceptual frameworks for the development of mobile
health interventions. We identified, named, categorized, integrated, and
synthesized the information retrieved from the literature reviews to
develop the conceptual framework. We then applied this framework by
developing a CA and testing it in a feasibility study. Results: The
Designing, Developing, Evaluating, and Implementing a
Smartphone-Delivered, Rule-Based Conversational Agent (DISCOVER)
conceptual framework includes 8 iterative steps grouped into 3 stages,
as follows: design, comprising defining the goal, creating an identity,
assembling the team, and selecting the delivery interface; development,
including developing the content and building the conversation flow; and
the evaluation and implementation of the CA. They were complemented by 2
cross-cuttingconsiderations-user-centered design and privacy and
security-that were relevant at all stages. This conceptual framework was
successfully applied in the development of a CA to support lifestyle
changes and prevent type 2 diabetes. Conclusions: Drawing on published
evidence, the DISCOVER conceptual framework provides a step-by-step
guide for developing rule-based, smartphone-delivered CAs. Further
evaluation of this framework in diverse health care areas and settings
and for a variety of users is needed to demonstrate its validity. Future
research should aim to explore the use of CAs to deliver health care
interventions, including behavior change and potential privacy and
safety concerns.","Dhinagaran, Dhakshenya Ardhithy and Martinengo, Laura and Ho, Moon-Ho
Ringo and Joty, Shafiq and Kowatsch, Tobia and Atun, Rifat and Car,
Lorainne Tudor",JMIR MHEALTH AND UHEALTH,,2022,10.2196/38740,,webofscience.bib,2023-09-02 14:05:29,Unclassified
WOS:000556208000013,Children Privacy Identification System in LINE Chatbot for Smart Toys,"Children's privacy concerns about smart toys are becoming more and more
critical in the toy industry. Parents and guardians continue to strive
to protect their children from unnecessary privacy risks such as
collection, and unconsented use of or access to their children's
information. However, there is still no standardized privacy framework,
which focuses on smart toys in this paradigm; making it difficult to
determine possible privacy violation in for example determining whether
a phrase shared with a smart toy is sensitive or not. To overcome this
challenge, we build a privacy identification system through Chatbot
technology. We call this system a Children Privacy Identification (CPI)
system. To develop CPI system, we divide our research works into two
parts: (1) Collect the phrase from the smart toys; and (2) Explore
privacy Identification based on Personally Identifiable Information
(PII) and Children's Online Privacy Protection Act (COPPA). For
illustration, we integrate the CPI system in LINE Chatbot. The result
shows that people feel more comfortable in talking to LINE Chatbot with
privacy protection.","Lin, Pei-Chun and Yankson, Benjamin and Lu, Zhihui and Hung, Patrick C.
K.",,"2019 IEEE 12TH INTERNATIONAL CONFERENCE ON CLOUD COMPUTING (IEEE CLOUD
2019)",2019,10.1109/CLOUD.2019.00026,,webofscience.bib,2023-09-02 14:05:29,Unclassified
WOS:000675475500029,Privacy Preserving Chatbot Conversations,"With chatbots gaining traction and their adoption growing in different
verticals, e.g. Health, Banking, Dating; and users sharing more and more
private information with chatbots - studies have started to highlight
the privacy risks of chatbots. In this paper, we propose two
privacy-preserving approaches for chatbot conversations. The first
approach applies `entity' based privacy filtering and transformation,
and can be applied directly on the app (client) side. It however
requires knowledge of the chatbot design to be enabled. We present a
second scheme based on Searchable Encryption that is able to preserve
user chat privacy, without requiring any knowledge of the chatbot
design. Finally, we present some experimental results based on a
real-life employee Help Desk chatbot that validates both the need and
feasibility of the proposed approaches.","Biswas, Debmalya",,"2020 IEEE THIRD INTERNATIONAL CONFERENCE ON ARTIFICIAL INTELLIGENCE AND
KNOWLEDGE ENGINEERING (AIKE 2020)",2020,10.1109/AIKE48582.2020.00035,,webofscience.bib,2023-09-02 14:05:29,Unclassified
WOS:000792102900001,"Drivers of privacy concerns when interacting with a chatbot in a
customer service encounter","Purpose This study aims to examine the antecedents of privacy concerns
in the era of artificial intelligence. Specifically, it focuses on the
impact of various factors related to interactions with a chatbot
(creepiness and perceived risk) and individual traits (familiarity with
chatbots and need for privacy) in relation to privacy when interacting
with a chatbot in the context of financial services. The moderating
effect of gender on these relationships was also examined.
Design/methodology/approach A total of 430 Canadians responded to an
online questionnaire after interacting with a chatbot in the context of
a simulated auto insurance quote. A structural equation model was used
to test the hypotheses. Findings The results showed that privacy
concerns are influenced primarily by creepiness, followed by perceived
risk and the need for privacy. The last two relationships are moderated
by gender. Conversely, familiarity with chatbots does not affect privacy
concerns in this context. Originality/value This study is the first to
consider the influence of creepiness as an antecedent of privacy
concerns arising from interactions with AI tools and highlight its key
impacts. It also shows how gender moderates specific relationships in
this context.","Bouhia, Mariem and Rajaobelina, Lova and PromTep, Sandrine and Arcand,
Manon and Ricard, Line",INTERNATIONAL JOURNAL OF BANK MARKETING,,2022,10.1108/IJBM-09-2021-0442,,webofscience.bib,2023-09-02 14:05:29,Unclassified
WOS:000657463100001,"Chatbots: Security, privacy, data protection, and social aspects","Chatbots are artificial communication systems becoming increasingly
popular and not all their security questions are clearly solved. People
use chatbots for assistance in shopping, bank communication, meal
delivery, healthcare, cars, and many other actions. However, it brings
an additional security risk and creates serious security challenges
which have to be handled. Understanding the underlying problems requires
defining the crucial steps in the techniques used to design chatbots
related to security. There are many factors increasing security threats
and vulnerabilities. All of them are comprehensively studied, and
security practices to decrease security weaknesses are presented. Modern
chatbots are no longer rule-based models, but they employ modern natural
language and machine learning techniques. Such techniques learn from a
conversation, which can contain personal information. The paper
discusses circumstances under which such data can be used and how
chatbots treat them. Many chatbots operate on a social/messaging
platform, which has their terms and conditions about data. The paper
aims to present a comprehensive study of security aspects in
communication with chatbots. The article could open a discussion and
highlight the problems of data storage and usage obtained from the
communication user-chatbot and propose some standards to protect the
user.","Hasal, Martin and Nowakova, Jana and Saghair, Khalifa Ahmed and Abdulla,
Hussam and Snasel, Vaclav and Ogiela, Lidia",CONCURRENCY AND COMPUTATION-PRACTICE \& EXPERIENCE,,2021,10.1002/cpe.6426,,webofscience.bib,2023-09-02 14:05:29,Unclassified
WOS:000951832100001,"I, chatbot! the impact of anthropomorphism and gaze direction on
willingness to disclose personal information and behavioral intentions","The present research focuses on the interplay between two common
features of the customer service chatbot experience: gaze direction and
anthropomorphism. Although the dominant approach in marketing theory and
practice is to make chatbots as human-like as possible, the current
study, built on the humanness-value-loyalty model, addresses the chain
of effects through which chatbots' nonverbal behaviors affect customers'
willingness to disclose personal information and purchase intentions. By
means of two experiments that adopt a real chatbot in a simulated
shopping environment (i.e., car rental and travel insurance), the
present work allows us to understand how to reduce individuals' tendency
to see conversational agents as less knowledgeable and empathetic
compared with humans. The results show that warmth perceptions are
affected by gaze direction, whereas competence perceptions are affected
by anthropomorphism. Warmth and competence perceptions are found to be
key drivers of consumers' skepticism toward the chatbot, which, in turn,
affects consumers' trust toward the service provider hosting the
chatbot, ultimately leading consumers to be more willing to disclose
their personal information and to repatronize the e-tailer in the
future. Building on the Theory of Mind, our results show that perceiving
competence from a chatbot makes individuals less skeptical as long as
they feel they are good at detecting others' ultimate intentions.","Pizzi, Gabriele and Vannucci, Virginia and Mazzoli, Valentina and
Donvito, Raffaele",PSYCHOLOGY \& MARKETING,,2023,10.1002/mar.21813,,webofscience.bib,2023-09-02 14:05:29,Unclassified
WOS:000634342000001,"EREBOTS: Privacy-Compliant Agent-Based Platform for Multi-Scenario
Personalized Health-Assistant Chatbots","Context. Asynchronous messaging is increasingly used to support
human-machine interactions, generally implemented through chatbots. Such
virtual entities assist the users in activities of different kinds
(e.g., work, leisure, and health-related) and are becoming ingrained
into humans' habits due to factors including (i) the availability of
mobile devices such as smartphones and tablets, (ii) the increasingly
engaging nature of chatbot interactions, (iii) the release of dedicated
APIs from messaging platforms, and (iv) increasingly complex AI-based
mechanisms to power the bots' behaviors. Nevertheless, most of the
modern chatbots rely on state machines (implementing conversational
rules) and one-fits-all approaches, neglecting personalization,
data-stream privacy management, multi-topic management/interconnection,
and multimodal interactions. Objective. This work addresses the
challenges above through an agent-based framework for chatbot
development named EREBOTS. Methods. The foundations of the framework are
based on the implementation of (i) multi-front-end connectors and
interfaces (i.e., Telegram, dedicated App, and web interface), (ii)
enabling the configuration of multi-scenario behaviors (i.e., preventive
physical conditioning, smoking cessation, and support for breast-cancer
survivors), (iii) online learning, (iv) personalized conversations and
recommendations (i.e., mood boost, anti-craving persuasion, and
balance-preserving physical exercises), and (v) responsive multi-device
monitoring interface (i.e., doctor and admin). Results. EREBOTS has been
tested in the context of physical balance preservation in social
confinement times (due to the ongoing pandemic). Thirteen individuals
characterized by diverse age, gender, and country distribution have
actively participated in the experimentation, reporting advancements in
the physical balance and overall satisfaction of the interaction and
exercises' variety they have been proposed.","Calvaresi, Davide and Calbimonte, Jean-Paul and Siboni, Enrico and
Eggenschwiler, Stefan and Manzo, Gaetano and Hilfiker, Roger and
Schumacher, Michael",ELECTRONICS,,2021,10.3390/electronics10060666,,webofscience.bib,2023-09-02 14:05:29,Unclassified
WOS:000787145300001,"Trust and digital privacy: willingness to disclose personal information
to banking chatbot services","This study explored digital privacy concerns in the use of chatbots as a
digital banking service. Three dimensions of trust were tested in
relation to user self-disclosure in order to better understand the
consumer-chatbot experience in banking. The methodology selected for
this research study followed a conclusive, pre-experimental, two-group
one-shot case study research design which made use of a non-probability
snowballing sampling technique. Privacy concerns were found to have a
significantly negative relationship with user self-disclosure in both
treatment groups. Respondents exposed to their preferred banking brand
experienced lower user self-disclosure and brand trust than those
exposed to a fictitious banking brand within the South African context.
It is recommended that companies using chatbots focus on easing privacy
concerns and build foundations of trust. The gains that chatbots have
made in the form of increased productivity and quality of customer
service rely on relationships with users who need to disclose personal
information. Through this study, we concluded that, despite its power to
influence decision-making, the power of a brand is not enough for
consumers to considerably increase self-disclosure. Rather, a bridge of
trust (through education, communication and product development) is
needed that encompasses all three elements of trust, which are brand
trust, cognitive trust and emotional trust. Limited research exists on
the relationship between financial services marketing and chatbot
adoption. Thus, this study addressed a theoretical gap, by adding brand
trust to existing studies on cognitive and emotional trust regarding
user self-disclosure.","Lappeman, James and Marlie, Siddeeqah and Johnson, Tamryn and
Poggenpoel, Sloane",JOURNAL OF FINANCIAL SERVICES MARKETING,,2023,10.1057/s41264-022-00154-z,,webofscience.bib,2023-09-02 14:05:29,Unclassified
WOS:000631254500039,SLA as a mechanism to manage risks related to chatbot services.,"Intelligent Chatbot services become one of the mainstream applications
in user help and many other areas. Apart from bringing numerous benefits
to users these services may bring additional risks to the companies that
employ them. The study starts with the review of the scale of chatbot
industry and common use cases by focusing on their applications \&
industry tendencies. Review of functionality and architecture of typical
chatbot services shows the potential risks associated with chatbots.
Analysis of such risks in the paper helped to build a checklist that
security managers can use to assess risks prior to chatbot
implementation. The proposed checklist was tested by reviewing a number
of Service Level Agreements (SLA) of real chatbot providers.","Gondaliya, Krishna and Butakov, Sergey and Zavarsky, Pavol",,"2020 IEEE 6TH INT CONFERENCE ON BIG DATA SECURITY ON CLOUD
(BIGDATASECURITY) / 6TH IEEE INT CONFERENCE ON HIGH PERFORMANCE AND
SMART COMPUTING, (HPSC) / 5TH IEEE INT CONFERENCE ON INTELLIGENT DATA
AND SECURITY (IDS)",2020,10.1109/BigDataSecurity-HPSC-IDS49724.2020.00050,,webofscience.bib,2023-09-02 14:05:29,Unclassified
WOS:000877356400002,"Should the chatbot ?save itself? or ?be helped by others?? The influence
of service recovery types on consumer perceptions of recovery
satisfaction","The application of artificial intelligence is considered essential to
adapt to a new cycle of industrial trans-formation and technological
advancements in many fields and industries. The extensive use of
artificial intel-ligence technology is expected to improve the level and
quality of services provided by companies adopting these methods. In
this study, we propose a novel approach to self-recovery by chatbot
systems after service failures based on social response theory.
Moreover, we explore differences in consumer perceptions of different
service recovery types and their impact on recovery satisfaction, and
discusses whether the intelligence of the compu-tational agent also has
an effect. We present the results of three scenario-based experiments,
which demonstrate the positive effect of chatbot self-recovery on
consumer satisfaction, and show the mediating paths of service recovery
types in terms of perceived functional value and privacy risks as well
as the boundary condition of the level of robot intelligence. This work
expands the range of applications of chatbots in the service industry
and provides a new framework for the governance of artificial
intelligence.","Song, Mengmeng and Du, Jingzhe and Xing, Xinyu and Mou, Jian",ELECTRONIC COMMERCE RESEARCH AND APPLICATIONS,,2022,10.1016/j.elerap.2022.101199,,webofscience.bib,2023-09-02 14:05:29,Unclassified
WOS:000708832400002,"Future directions for chatbot research: an interdisciplinary research
agenda","Chatbots are increasingly becoming important gateways to digital
services and information-taken up within domains such as customer
service, health, education, and work support. However, there is only
limited knowledge concerning the impact of chatbots at the individual,
group, and societal level. Furthermore, a number of challenges remain to
be resolved before the potential of chatbots can be fully realized. In
response, chatbots have emerged as a substantial research area in recent
years. To help advance knowledge in this emerging research area, we
propose a research agenda in the form of future directions and
challenges to be addressed by chatbot research. This proposal
consolidates years of discussions at the CONVERSATIONS workshop series
on chatbot research. Following a deliberative research analysis process
among the workshop participants, we explore future directions within six
topics of interest: (a) users and implications, (b) user experience and
design, (c) frameworks and platforms, (d) chatbots for collaboration,
(e) democratizing chatbots, and (f) ethics and privacy. For each of
these topics, we provide a brief overview of the state of the art,
discuss key research challenges, and suggest promising directions for
future research. The six topics are detailed with a 5-year perspective
in mind and are to be considered items of an interdisciplinary research
agenda produced collaboratively by avid researchers in the field.","Folstad, Asbjorn and Araujo, Theo and Law, Effie Lai-Chong and
Brandtzaeg, Petter Bae and Papadopoulos, Symeon and Reis, Lea and Baez,
Marcos and Laban, Guy and McAllister, Patrick and Ischen, Carolin and
Wald, Rebecca and Catania, Fabio and Meyer von Wolff, Raphael and
Hobert, Sebastian and Luger, Ewa",COMPUTING,,2021,10.1007/s00607-021-01016-7,,webofscience.bib,2023-09-02 14:05:29,Unclassified
WOS:000778774900010,"Ethical Chatbot Design for Reducing Negative Effects of Biased Data and
Unethical Conversations","AI technology is being introduced into various public and private
service domains, transforming existing computing systems or creating new
ones. While AI technologies can provide benefits to humans and society,
the unexpected consequences (e.g., malfunctions) of AI systems can cause
social losses. For this reason, research on ethical design for the
development of AI-based systems is becoming important. In this paper,
from existing studies on AI ethics, general guidelines such as
transparency, explainability, predictability, accountability, fairness,
privacy, and control for the ethical design of AI systems are reviewed.
And, based on the ethical design guidelines, we discuss ethical design
to reduce the negative effects of biased data and unethical dialogues in
AI-based conversational chatbots.","Bang, Junseong and Kim, Sineae and Nam, Jang Won and Yang, Dong-Geun",,"2021 INTERNATIONAL CONFERENCE ON PLATFORM TECHNOLOGY AND SERVICE
(PLATCON)",2021,10.1109/PlatCon53246.2021.9680760,,webofscience.bib,2023-09-02 14:05:29,Unclassified
